{
  "receipt_id": "36c56a82-42a4-41bd-bc0a-725d90a619a5",
  "protocol_version": 1,
  "security_mode": "GatewayOnly",
  "enclave_measurements": {
    "pcr0": [
      165,
      132,
      78,
      136,
      137,
      123,
      112,
      195,
      24,
      190,
      249,
      41,
      239,
      77,
      253,
      108,
      115,
      4,
      197,
      44,
      75,
      201,
      195,
      243,
      145,
      50,
      240,
      253,
      204,
      236,
      243,
      235,
      91,
      171,
      112,
      17,
      14,
      228,
      42,
      18,
      80,
      154,
      49,
      192,
      55,
      40,
      134,
      148
    ],
    "pcr1": [
      59,
      78,
      153,
      86,
      9,
      5,
      102,
      29,
      59,
      223,
      177,
      232,
      146,
      187,
      174,
      183,
      211,
      125,
      28,
      120,
      118,
      0,
      114,
      165,
      6,
      35,
      40,
      54,
      131,
      131,
      111,
      141,
      5,
      150,
      66,
      48,
      243,
      57,
      236,
      195,
      72,
      237,
      186,
      144,
      153,
      119,
      39,
      88
    ],
    "pcr2": [
      90,
      92,
      144,
      241,
      21,
      140,
      240,
      41,
      71,
      250,
      141,
      237,
      99,
      235,
      82,
      154,
      53,
      91,
      158,
      196,
      208,
      174,
      245,
      92,
      135,
      143,
      62,
      7,
      188,
      101,
      131,
      191,
      9,
      239,
      84,
      16,
      172,
      139,
      240,
      152,
      92,
      57,
      223,
      25,
      3,
      153,
      172,
      214
    ],
    "pcr8": null,
    "measurement_type": "tdx-mrtd-rtmr"
  },
  "attestation_doc_hash": [
    224,
    233,
    242,
    103,
    133,
    215,
    253,
    84,
    255,
    173,
    108,
    158,
    123,
    165,
    190,
    200,
    14,
    185,
    184,
    122,
    233,
    96,
    195,
    183,
    243,
    131,
    156,
    30,
    108,
    65,
    183,
    255
  ],
  "request_hash": [
    61,
    219,
    26,
    20,
    146,
    116,
    194,
    34,
    60,
    41,
    123,
    69,
    117,
    130,
    86,
    85,
    255,
    107,
    57,
    56,
    97,
    48,
    35,
    99,
    154,
    173,
    233,
    29,
    77,
    22,
    209,
    12
  ],
  "response_hash": [
    178,
    103,
    0,
    17,
    49,
    6,
    233,
    169,
    193,
    46,
    72,
    173,
    123,
    85,
    168,
    53,
    41,
    98,
    195,
    149,
    148,
    148,
    244,
    151,
    253,
    93,
    211,
    8,
    190,
    137,
    227,
    220
  ],
  "policy_version": "v1-default",
  "sequence_number": 0,
  "execution_timestamp": 1771040197,
  "model_id": "stage-0",
  "model_version": "1.0",
  "execution_time_ms": 68,
  "memory_peak_mb": 0,
  "signature": [
    47,
    97,
    249,
    189,
    10,
    99,
    27,
    151,
    149,
    145,
    138,
    20,
    192,
    215,
    229,
    241,
    147,
    102,
    86,
    10,
    154,
    35,
    95,
    209,
    196,
    81,
    37,
    35,
    115,
    175,
    209,
    254,
    26,
    59,
    141,
    247,
    34,
    6,
    153,
    168,
    61,
    86,
    244,
    130,
    64,
    108,
    181,
    105,
    62,
    247,
    198,
    138,
    107,
    49,
    190,
    82,
    30,
    77,
    27,
    17,
    116,
    133,
    240,
    1
  ]
}