{
  "receipt_id": "1a8da4bc-ce56-4150-aa0b-7d4e9ba2ed5b",
  "protocol_version": 1,
  "security_mode": "GatewayOnly",
  "enclave_measurements": {
    "pcr0": [
      110,
      210,
      135,
      122,
      18,
      142,
      84,
      148,
      129,
      63,
      173,
      226,
      165,
      84,
      119,
      174,
      41,
      31,
      125,
      84,
      1,
      96,
      233,
      102,
      91,
      75,
      194,
      17,
      66,
      239,
      85,
      110,
      15,
      54,
      147,
      29,
      186,
      163,
      55,
      65,
      180,
      118,
      139,
      0,
      174,
      3,
      2,
      237
    ],
    "pcr1": [
      75,
      77,
      91,
      54,
      97,
      179,
      239,
      193,
      41,
      32,
      144,
      12,
      128,
      225,
      38,
      228,
      206,
      120,
      60,
      82,
      45,
      230,
      192,
      42,
      42,
      91,
      247,
      175,
      58,
      43,
      147,
      39,
      184,
      103,
      118,
      241,
      136,
      228,
      190,
      28,
      28,
      64,
      74,
      18,
      157,
      189,
      164,
      147
    ],
    "pcr2": [
      149,
      81,
      140,
      239,
      150,
      1,
      79,
      212,
      115,
      4,
      51,
      219,
      46,
      46,
      241,
      231,
      81,
      85,
      162,
      51,
      100,
      66,
      48,
      171,
      27,
      65,
      52,
      44,
      164,
      78,
      36,
      171,
      90,
      163,
      111,
      197,
      80,
      167,
      49,
      183,
      237,
      14,
      173,
      78,
      186,
      30,
      241,
      104
    ],
    "pcr8": null,
    "measurement_type": "nitro-pcr"
  },
  "attestation_doc_hash": [
    231,
    239,
    50,
    188,
    246,
    219,
    125,
    63,
    154,
    162,
    231,
    42,
    47,
    55,
    228,
    249,
    222,
    105,
    159,
    157,
    54,
    200,
    171,
    23,
    9,
    236,
    209,
    203,
    162,
    167,
    209,
    162
  ],
  "request_hash": [
    146,
    30,
    142,
    187,
    4,
    8,
    80,
    98,
    7,
    224,
    249,
    253,
    175,
    184,
    9,
    214,
    38,
    157,
    4,
    98,
    155,
    29,
    79,
    173,
    22,
    255,
    155,
    200,
    225,
    101,
    18,
    57
  ],
  "response_hash": [
    253,
    253,
    221,
    242,
    172,
    120,
    213,
    183,
    50,
    161,
    88,
    48,
    13,
    164,
    110,
    216,
    22,
    180,
    106,
    233,
    93,
    33,
    103,
    104,
    218,
    150,
    196,
    124,
    231,
    6,
    86,
    242
  ],
  "policy_version": "v1-default",
  "sequence_number": 0,
  "execution_timestamp": 1772015089,
  "model_id": "stage-0",
  "model_version": "1.0",
  "execution_time_ms": 78,
  "memory_peak_mb": 0,
  "signature": [
    82,
    198,
    122,
    172,
    192,
    225,
    191,
    196,
    147,
    16,
    223,
    63,
    149,
    82,
    222,
    242,
    135,
    100,
    128,
    233,
    131,
    13,
    47,
    11,
    13,
    205,
    163,
    248,
    251,
    111,
    192,
    149,
    126,
    25,
    90,
    154,
    211,
    85,
    238,
    185,
    96,
    113,
    172,
    18,
    6,
    95,
    228,
    187,
    153,
    20,
    196,
    108,
    248,
    146,
    110,
    58,
    61,
    168,
    139,
    12,
    149,
    161,
    101,
    2
  ]
}